{
  "schemaVersion": "1.0",
  "repository": "WorldHealthOrganization/smart-ig-starter-kit",
  "generatedFrom": "53631980e0d62e0905a69f4761aa5ee24d81aeaa",
  "roles": [
    {
      "id": "author",
      "name": "Author",
      "type": "person",
      "description": "Creates and modifies content, and pushes to a branch.",
      "inherits": [
        "reviewer"
      ],
      "capabilities": [
        "git-push"
      ],
      "permissions": [
        "content-authoring"
      ]
    },
    {
      "id": "business-analyst",
      "name": "Business Analyst",
      "type": "person",
      "description": "Authors the structured L2 DAK components: business processes, data dictionary, decision and scheduling logic.",
      "inherits": [
        "author"
      ],
      "capabilities": [],
      "permissions": [
        "bpmn-authoring",
        "dmn-authoring",
        "data-dictionary-authoring"
      ],
      "meta": {
        "smartBaseAnalog": "SGAuthoring.Persona.BusinessAnalyst",
        "lifecycle": [
          "author",
          "validate"
        ]
      }
    },
    {
      "id": "clinical-sme",
      "name": "Clinical Subject Matter Expert",
      "type": "person",
      "description": "Validates clinical accuracy of L2 content against the underlying L1 guideline. Sign-off authority on clinical meaning.",
      "inherits": [
        "reviewer"
      ],
      "capabilities": [],
      "permissions": [
        "clinical-validation"
      ],
      "meta": {
        "smartBaseAnalog": "SGAuthoring.Persona.ClinicalSME",
        "lifecycle": [
          "validate",
          "review"
        ]
      }
    },
    {
      "id": "commons-steward",
      "name": "Commons and Governance Steward",
      "type": "person",
      "description": "Owns what crosses Implementation Guide boundaries: concept governance, identifier grammar, reuse decisions and release authorisation.",
      "inherits": [
        "terminologist",
        "programme-manager",
        "publication-manager"
      ],
      "capabilities": [],
      "meta": {
        "expert": true,
        "skills": "ai/skills/commons",
        "lifecycle": [
          "author",
          "validate",
          "publish"
        ]
      }
    },
    {
      "id": "content-reviewer",
      "name": "Content Reviewer",
      "type": "person",
      "description": "Formal approval authority on content transitions, including the L2 to L3 gate.",
      "inherits": [
        "reviewer"
      ],
      "capabilities": [],
      "permissions": [
        "approval-authority"
      ],
      "meta": {
        "smartBaseAnalog": "SGAuthoring.Persona.ContentReviewer",
        "lifecycle": [
          "review"
        ]
      }
    },
    {
      "id": "fhir-modeller",
      "name": "FHIR Modeller",
      "type": "person",
      "description": "Authors L3 FHIR artifacts: logical models, profiles, questionnaires, CQL, plan definitions, measures.",
      "inherits": [
        "author"
      ],
      "capabilities": [
        "sushi-compiler",
        "ig-publisher"
      ],
      "permissions": [
        "cql-authoring"
      ],
      "meta": {
        "smartBaseAnalog": "SGAuthoring.Persona.FHIRModeller",
        "lifecycle": [
          "author",
          "validate"
        ]
      }
    },
    {
      "id": "l2-dak-expert",
      "name": "L2 DAK Expert",
      "type": "person",
      "description": "Authors and validates the nine DAK components. The L2 half of the transformation: everything upstream of the L2 to L3 gate.",
      "inherits": [
        "business-analyst",
        "clinical-sme"
      ],
      "capabilities": [
        "bpmn-tooling"
      ],
      "meta": {
        "expert": true,
        "skills": "ai/skills/l2",
        "lifecycle": [
          "plan",
          "author",
          "validate"
        ]
      }
    },
    {
      "id": "l3-ig-expert",
      "name": "L3 IG Expert",
      "type": "person",
      "description": "Authors and validates FHIR artifacts from L2 sources. The L3 half of the transformation: everything downstream of the gate.",
      "inherits": [
        "fhir-modeller",
        "qc-reviewer"
      ],
      "capabilities": [
        "sushi-compiler",
        "ig-publisher"
      ],
      "meta": {
        "expert": true,
        "skills": "ai/skills/l3",
        "lifecycle": [
          "author",
          "validate",
          "test"
        ]
      }
    },
    {
      "id": "programme-manager",
      "name": "Programme Manager",
      "type": "person",
      "description": "Governance oversight, scope, and release authorisation.",
      "inherits": [
        "content-reviewer"
      ],
      "capabilities": [
        "git-push"
      ],
      "permissions": [
        "project-governance",
        "release-authorization"
      ],
      "meta": {
        "smartBaseAnalog": "SGAuthoring.Persona.ProgrammeManager",
        "lifecycle": [
          "plan",
          "review",
          "publish"
        ]
      }
    },
    {
      "id": "publication-manager",
      "name": "Publication Manager",
      "type": "person",
      "description": "Runs the publication process and manages releases.",
      "inherits": [
        "author"
      ],
      "capabilities": [
        "ig-publisher"
      ],
      "permissions": [
        "release-management"
      ],
      "meta": {
        "smartBaseAnalog": "SGAuthoring.Persona.PublicationManager",
        "lifecycle": [
          "publish"
        ]
      }
    },
    {
      "id": "qc-reviewer",
      "name": "Quality Control Reviewer",
      "type": "person",
      "description": "Runs the build and quality checks and reports on their results.",
      "inherits": [
        "reviewer"
      ],
      "capabilities": [
        "ig-publisher"
      ],
      "permissions": [
        "qa-reporting"
      ],
      "meta": {
        "smartBaseAnalog": "SGAuthoring.Persona.QCReviewer",
        "lifecycle": [
          "validate",
          "test"
        ]
      }
    },
    {
      "id": "reviewer",
      "name": "Reviewer",
      "type": "person",
      "description": "Reviews content and leaves comments. Cannot author or push.",
      "inherits": [
        "viewer"
      ],
      "capabilities": [],
      "permissions": [
        "review-comments"
      ]
    },
    {
      "id": "technical-officer",
      "name": "Technical Officer",
      "type": "person",
      "description": "First-pass review and coordination with subject matter experts.",
      "inherits": [
        "reviewer"
      ],
      "capabilities": [
        "git-push"
      ],
      "permissions": [
        "first-pass-review",
        "sme-coordination"
      ],
      "meta": {
        "smartBaseAnalog": "SGAuthoring.Persona.TechnicalOfficer",
        "lifecycle": [
          "review"
        ]
      }
    },
    {
      "id": "terminologist",
      "name": "Terminologist",
      "type": "person",
      "description": "Owns code systems, value sets, concept maps and bindings to the WHO Commons glossary.",
      "inherits": [
        "author"
      ],
      "capabilities": [],
      "permissions": [
        "terminology-management"
      ],
      "meta": {
        "smartBaseAnalog": "SGAuthoring.Persona.Terminologist",
        "lifecycle": [
          "author",
          "validate"
        ]
      }
    },
    {
      "id": "translator",
      "name": "Translator",
      "type": "person",
      "description": "Produces and maintains language variants of narrative and designations.",
      "inherits": [
        "author"
      ],
      "capabilities": [],
      "permissions": [
        "translation"
      ],
      "meta": {
        "smartBaseAnalog": "SGAuthoring.Persona.Translator",
        "lifecycle": [
          "author"
        ]
      }
    },
    {
      "id": "viewer",
      "name": "Viewer",
      "type": "person",
      "description": "Reads published and in-progress content. Submits feedback. Cannot write.",
      "inherits": [],
      "capabilities": []
    }
  ],
  "capabilities": [
    {
      "id": "bpmn-tooling",
      "name": "BPMN tooling",
      "description": "Reads and writes BPMN 2.0 XML. Camunda Modeler is recommended because it emits the metadata L3 authoring needs.",
      "detection": {
        "method": "always",
        "value": null
      }
    },
    {
      "id": "docker",
      "name": "Docker",
      "description": "Runs the local test harnesses in testing/docker.",
      "detection": {
        "method": "command",
        "value": "docker --version"
      }
    },
    {
      "id": "git-push",
      "name": "Git push",
      "description": "Write access to the target repository.",
      "detection": {
        "method": "command",
        "value": "git"
      }
    },
    {
      "id": "ig-publisher",
      "name": "HL7 IG Publisher",
      "description": "Builds the Implementation Guide and runs conformance validation against smart-base profiles. The only place several classes of defect appear.",
      "detection": {
        "method": "file-exists",
        "value": "input-cache/publisher.jar"
      },
      "requires": [
        "java-runtime"
      ]
    },
    {
      "id": "java-runtime",
      "name": "Java runtime",
      "description": "Java 21 or later. Required by the IG Publisher.",
      "detection": {
        "method": "command",
        "value": "java -version"
      }
    },
    {
      "id": "node-runtime",
      "name": "Node.js runtime",
      "description": "Node.js 18 or later. Required by the package maintenance scripts.",
      "detection": {
        "method": "command",
        "value": "node --version"
      }
    },
    {
      "id": "python3",
      "name": "Python 3",
      "description": "Used by extraction tooling for DAK spreadsheets.",
      "detection": {
        "method": "command",
        "value": "python3 --version"
      }
    },
    {
      "id": "sushi-compiler",
      "name": "SUSHI",